{
  "schema_version": "1.0.0",
  "id": "rho-band",
  "kind": "glossary_term",
  "term": "ρ-band",
  "definition": "ρ = RMSE / 0.05 mag (noise floor). Bands: A < 2, B < 4 (accept = A∪B = ρ<4), C < 8, D ≥ 8. ALWAYS quote with its generator (which forward model produced ρ) — a band without its generator is meaningless.",
  "status": "canon",
  "promoted_on": "2026-06-04",
  "created_at": "2026-06-04T00:00:00Z",
  "coined_in": "notebooks/inversion/survey/concepts/rho_band.md",
  "aliases": [
    "rho band",
    "ρ band"
  ],
  "related_terms": [
    "generator"
  ]
}
