{
  "schema_version": "1.0.0",
  "id": "component-rotation-matrices",
  "kind": "glossary_term",
  "term": "component-rotation-matrices",
  "definition": "Dict[component -> (N,4,4) homogeneous rotation matrices] applying the articulation angles, consumed by the shadow engine and LC renderer.",
  "status": "provisional",
  "coined_in": "research_os/backfill/W-D_tool_pipeline_scour.md",
  "synonyms_blocked": [],
  "aliases": [],
  "related_terms": [],
  "created_at": "2026-06-07T00:00:00Z"
}
