{
  "schema_version": "1.0.0",
  "id": "body-twin",
  "kind": "glossary_term",
  "term": "body-twin",
  "definition": "An attitude q and its canonical-hemisphere antipode produce bit-exact identical light curves (s043 verified max |Δ| = 2.29e-08 mag, ~6 orders below noise). Consequence: the (q,ω) search space halves — deduplicate to a canonical hemisphere for ~2× speedup at every pipeline stage.",
  "status": "canon",
  "coined_in": "s043",
  "promoted_on": "2026-05-06",
  "synonyms_blocked": ["twin attitude", "body double", "mirror attitude"],
  "aliases": [],
  "related_terms": ["polhode-diameter"],
  "created_at": "2026-05-06T00:00:00Z",
  "updated_at": "2026-05-06T00:00:00Z"
}
