{
  "schema_version": "1.0.0",
  "id": "anchor-epoch",
  "kind": "glossary_term",
  "term": "anchor-epoch",
  "definition": "An integer epoch index (or set of indices) selected as a cross/filter anchor \u2014 e.g. the sharpness-scan anchor A,B or the bright-peak/spec-event indices.",
  "status": "provisional",
  "coined_in": "research_os/backfill/W-D_tool_pipeline_scour.md",
  "synonyms_blocked": [],
  "aliases": [],
  "related_terms": [
    "ia-cloud",
    "single-wind-lc-window"
  ],
  "created_at": "2026-06-07T00:00:00Z"
}
