{
  "schema_version": "1.0.0",
  "id": "isophotic",
  "kind": "glossary_term",
  "term": "isophotic",
  "definition": "Same-brightness. The constraint that defines an IA Cloud: the locus of attitudes that reproduce the observed photometric value at one epoch within tolerance.",
  "status": "canon",
  "promoted_on": "2026-06-04",
  "created_at": "2026-06-04T00:00:00Z",
  "related_terms": [
    "ia-cloud"
  ]
}
