{
  "schema_version": "1.0.0",
  "id": "multi-omegadir-start",
  "kind": "glossary_term",
  "term": "multi-ωdir-start",
  "definition": "Starting LM-Polish from multiple ω-DIRECTIONS — specifically the surviving ω-directions of an IA Cloud Cross (the cross IS the start-set). Distinguished from generic 'multistart', which is ambiguous about what varies.",
  "status": "canon",
  "promoted_on": "2026-06-04",
  "created_at": "2026-06-04T00:00:00Z",
  "synonyms_blocked": [
    "multistart"
  ],
  "related_terms": [
    "ia-cloud-cross",
    "lm-polish",
    "finite-diff-omega-aliasing"
  ]
}
