{
  "schema_version": "1.0.0",
  "id": "wind",
  "kind": "glossary_term",
  "term": "Wind",
  "definition": "One full attitude cycle (≈ one tumble period).",
  "status": "canon",
  "promoted_on": "2026-06-04",
  "created_at": "2026-06-04T00:00:00Z",
  "related_terms": [
    "single-wind-lc-window",
    "finite-diff-omega-aliasing"
  ]
}
