{
  "schema_version": "1.0.0",
  "id": "component-angles",
  "kind": "glossary_term",
  "term": "component-angles",
  "definition": "Dict[component -> (N,) articulation angles in degrees] for a solar-panel/antenna over the epochs, from a behavior or keyframe interpolator.",
  "status": "provisional",
  "coined_in": "research_os/backfill/W-D_tool_pipeline_scour.md",
  "synonyms_blocked": [],
  "aliases": [],
  "related_terms": [],
  "created_at": "2026-06-07T00:00:00Z"
}
