{
  "schema_version": "1.0.0",
  "id": "light-curve",
  "kind": "glossary_term",
  "term": "light-curve",
  "definition": "A (t, magnitude) time-series of apparent brightness \u2014 the generic LC artifact, including surrogate-predicted curves; the observable inversion fits.",
  "status": "provisional",
  "coined_in": "research_os/backfill/W-D_tool_pipeline_scour.md",
  "synonyms_blocked": [],
  "aliases": [],
  "related_terms": [
    "hifi-lightcurve",
    "rho-band"
  ],
  "created_at": "2026-06-07T00:00:00Z"
}
