{
  "schema_version": "1.0.0",
  "id": "candidate-set",
  "kind": "glossary_term",
  "term": "candidate-set",
  "definition": "A set/ranked list of (q0,\u03c9) candidate states surviving the cross+filter, before final ranking/polish (e.g. an OptimizationResult list).",
  "status": "provisional",
  "coined_in": "research_os/backfill/W-D_tool_pipeline_scour.md",
  "synonyms_blocked": [],
  "aliases": [],
  "related_terms": [
    "q0-omega-state",
    "ia-cloud-cross"
  ],
  "created_at": "2026-06-07T00:00:00Z"
}
