{
  "schema_version": "1.0.0",
  "id": "lc-comparison-plot",
  "kind": "glossary_term",
  "term": "lc-comparison-plot",
  "definition": "A rendered figure artifact (PNG/HTML) overlaying LCs with residual panels \u2014 a viz output, not a numeric artifact.",
  "status": "provisional",
  "coined_in": "research_os/backfill/W-D_tool_pipeline_scour.md",
  "synonyms_blocked": [],
  "aliases": [],
  "related_terms": [],
  "created_at": "2026-06-07T00:00:00Z"
}
